{
  "$schema": "../../../schema/authority-map.schema.json",
  "schema_version": "1.0",
  "case_id": "H04",
  "status": "draft",
  "normalization": {"level": "N0", "task_blind": true, "semantic_additions": false, "normalizer_ref": "audit/provenance.md#normalizer"},
  "provenance_ref": "audit/provenance.md",
  "authorities": [
    {"authority_id": "repo.architecture", "logical_role": "architecture", "exposed_path": "SPEC.md", "availability": "present_at_cutoff", "source": {"kind": "repo_file", "cutoff_ref": "a51d9915e2eee83e375f13936df976fb82ed4475", "path": "SPEC.md", "sha256": "72bf607a42066ccc2d8a8d86bb421ca7e6030bc1e92a5a5f0be979fabebe595d"}, "transform": "copy", "semantic_delta": false},
    {"authority_id": "docs.knowledge-router", "logical_role": "development", "exposed_path": "docs/README.md", "availability": "present_at_cutoff", "source": {"kind": "repo_file", "cutoff_ref": "a51d9915e2eee83e375f13936df976fb82ed4475", "path": "docs/README.md", "sha256": "7ac5f092f0c0ebda36ce3f1108177419b790945e868e71a74614763bbd428900"}, "transform": "copy", "semantic_delta": false},
    {"authority_id": "kernel.skills-contract", "logical_role": "product_contract", "exposed_path": "docs/specs/kernel/skills.md", "availability": "present_at_cutoff", "source": {"kind": "repo_file", "cutoff_ref": "a51d9915e2eee83e375f13936df976fb82ed4475", "path": "docs/specs/kernel/skills.md", "sha256": "96c5311086783c9d6bfcf599cf4f166b4ad6809173b9ec8a91d48f4ff685cd7f"}, "transform": "copy", "semantic_delta": false},
    {"authority_id": "gateway.capability-contract", "logical_role": "product_contract", "exposed_path": "docs/specs/gateway/agent-capabilities.md", "availability": "present_at_cutoff", "source": {"kind": "repo_file", "cutoff_ref": "a51d9915e2eee83e375f13936df976fb82ed4475", "path": "docs/specs/gateway/agent-capabilities.md", "sha256": "dab1c3d62d31ef5b596fbbecc95dd239344f483133d4382c6fe7a82b49ad687a"}, "transform": "copy", "semantic_delta": false},
    {"authority_id": "kernel.skill-discovery", "logical_role": "architecture", "exposed_path": "src/agent/core/skills/discovery.py", "availability": "present_at_cutoff", "source": {"kind": "repo_file", "cutoff_ref": "a51d9915e2eee83e375f13936df976fb82ed4475", "path": "src/agent/core/skills/discovery.py", "sha256": "df1d6623dc355e3f32254b73d67b3430a2eb127aec659d0a733d19a4058236db"}, "transform": "copy", "semantic_delta": false},
    {"authority_id": "kernel.skill-registry", "logical_role": "architecture", "exposed_path": "src/agent/core/skills/registry.py", "availability": "present_at_cutoff", "source": {"kind": "repo_file", "cutoff_ref": "a51d9915e2eee83e375f13936df976fb82ed4475", "path": "src/agent/core/skills/registry.py", "sha256": "9fc5daaf923dbcddfba52cedacad7dafe5ab8786b307d410fd72796ee0d79106"}, "transform": "copy", "semantic_delta": false},
    {"authority_id": "pa.product-composition", "logical_role": "architecture", "exposed_path": "src/personal_assistant/product.py", "availability": "present_at_cutoff", "source": {"kind": "repo_file", "cutoff_ref": "a51d9915e2eee83e375f13936df976fb82ed4475", "path": "src/personal_assistant/product.py", "sha256": "129346bf9b686cb6582c8196c466100e5556c3c561addcb76e3162f79b88650f"}, "transform": "copy", "semantic_delta": false},
    {"authority_id": "cli.product-composition", "logical_role": "architecture", "exposed_path": "src/coding_cli/product.py", "availability": "present_at_cutoff", "source": {"kind": "repo_file", "cutoff_ref": "a51d9915e2eee83e375f13936df976fb82ed4475", "path": "src/coding_cli/product.py", "sha256": "ca015845476d721ce20fde37d3ba8f23253a29c23a88ba2aaf18598fefabe472"}, "transform": "copy", "semantic_delta": false},
    {"authority_id": "im.skill-selector", "logical_role": "architecture", "exposed_path": "src/IM/frontend/src/features/settings/agents/skill-source-selector.tsx", "availability": "present_at_cutoff", "source": {"kind": "repo_file", "cutoff_ref": "a51d9915e2eee83e375f13936df976fb82ed4475", "path": "src/IM/frontend/src/features/settings/agents/skill-source-selector.tsx", "sha256": "c34487f1e7d32222f2ef424cc515c1e80ba6cdb5bb9855ff233601537ec23ffa"}, "transform": "copy", "semantic_delta": false},
    {"authority_id": "history.target-unit", "logical_role": "historical_decision", "exposed_path": "__absent__/feat-519-workspace-compat-skills", "availability": "absent_at_cutoff", "source": {"kind": "none", "cutoff_ref": "a51d9915e2eee83e375f13936df976fb82ed4475"}, "transform": "absent_marker", "semantic_delta": false, "notes": "The compatibility roots, group control and persistence changes do not exist in the candidate product snapshot."}
  ]
}
