{
  "$schema": "../../../schema/authority-map.schema.json",
  "schema_version": "1.0",
  "case_id": "H05",
  "status": "draft",
  "normalization": {"level": "N0", "task_blind": true, "semantic_additions": false, "normalizer_ref": "audit/provenance.md#normalizer"},
  "provenance_ref": "audit/provenance.md",
  "authorities": [
    {"authority_id": "repo.architecture", "logical_role": "architecture", "exposed_path": "SPEC.md", "availability": "present_at_cutoff", "source": {"kind": "repo_file", "cutoff_ref": "f54e008b120d55bb5563cd127978dc336e2e0aac", "path": "SPEC.md", "sha256": "80b3e30e8fde08ce2b8a80becf70a791c15cd90fe3402a2f795d557adeb6caa3"}, "transform": "copy", "semantic_delta": false},
    {"authority_id": "docs.knowledge-router", "logical_role": "development", "exposed_path": "docs/README.md", "availability": "present_at_cutoff", "source": {"kind": "repo_file", "cutoff_ref": "f54e008b120d55bb5563cd127978dc336e2e0aac", "path": "docs/README.md", "sha256": "14c40009bd598287831b845160de60781ec743dcef8ced2ad3185b968c32b881"}, "transform": "copy", "semantic_delta": false},
    {"authority_id": "im.agent-contract", "logical_role": "product_contract", "exposed_path": "docs/specs/im/agents-nodes.md", "availability": "present_at_cutoff", "source": {"kind": "repo_file", "cutoff_ref": "f54e008b120d55bb5563cd127978dc336e2e0aac", "path": "docs/specs/im/agents-nodes.md", "sha256": "f6520c11d29e80d147616a8b37af602678d3d80dc7d21001db636ae90c506c74"}, "transform": "copy", "semantic_delta": false},
    {"authority_id": "gateway.capability-contract", "logical_role": "product_contract", "exposed_path": "docs/specs/gateway/agent-capabilities.md", "availability": "present_at_cutoff", "source": {"kind": "repo_file", "cutoff_ref": "f54e008b120d55bb5563cd127978dc336e2e0aac", "path": "docs/specs/gateway/agent-capabilities.md", "sha256": "64fee1cbcfbf7a175b4dd60782156e3d630fa91113f0bb749d9f49287de79c56"}, "transform": "copy", "semantic_delta": false},
    {"authority_id": "im.workspace-model", "logical_role": "architecture", "exposed_path": "src/IM/domain/models.py", "availability": "present_at_cutoff", "source": {"kind": "repo_file", "cutoff_ref": "f54e008b120d55bb5563cd127978dc336e2e0aac", "path": "src/IM/domain/models.py", "sha256": "d8321a496d4c8320c77560ac231c1758f03057e039918aad746fe21e9d8b3d52"}, "transform": "copy", "semantic_delta": false},
    {"authority_id": "im.config-service", "logical_role": "architecture", "exposed_path": "src/IM/application/config_service.py", "availability": "present_at_cutoff", "source": {"kind": "repo_file", "cutoff_ref": "f54e008b120d55bb5563cd127978dc336e2e0aac", "path": "src/IM/application/config_service.py", "sha256": "42ec6c5f2a00c1190265f0ce6c9cdcdf5de80347c2bfd329e0a836a14854a110"}, "transform": "copy", "semantic_delta": false},
    {"authority_id": "gateway.workspace-owner", "logical_role": "architecture", "exposed_path": "src/personal_assistant/gateway/composition.py", "availability": "present_at_cutoff", "source": {"kind": "repo_file", "cutoff_ref": "f54e008b120d55bb5563cd127978dc336e2e0aac", "path": "src/personal_assistant/gateway/composition.py", "sha256": "79e0270b70baddd8e99521db1d21c879cffb91828d22b10fb0e37cdd60984eae"}, "transform": "copy", "semantic_delta": false},
    {"authority_id": "gateway.agent-config-store", "logical_role": "architecture", "exposed_path": "src/personal_assistant/config/local_store.py", "availability": "present_at_cutoff", "source": {"kind": "repo_file", "cutoff_ref": "f54e008b120d55bb5563cd127978dc336e2e0aac", "path": "src/personal_assistant/config/local_store.py", "sha256": "f1cead099472c166a21ca57f215edaabec98bf64924bd36e1a1e70b3b745982d"}, "transform": "copy", "semantic_delta": false},
    {"authority_id": "im.agent-create-ui", "logical_role": "architecture", "exposed_path": "src/IM/frontend/src/features/settings/agents/agent-create-page.tsx", "availability": "present_at_cutoff", "source": {"kind": "repo_file", "cutoff_ref": "f54e008b120d55bb5563cd127978dc336e2e0aac", "path": "src/IM/frontend/src/features/settings/agents/agent-create-page.tsx", "sha256": "389c2e1835460c3b98b83b4aa853d56caa4510301ebf371bf5d0779be117880c"}, "transform": "copy", "semantic_delta": false},
    {"authority_id": "history.target-unit", "logical_role": "historical_decision", "exposed_path": "__absent__/feat-515-agent-workspace-root-selection", "availability": "absent_at_cutoff", "source": {"kind": "none", "cutoff_ref": "f54e008b120d55bb5563cd127978dc336e2e0aac"}, "transform": "absent_marker", "semantic_delta": false, "notes": "The create-time custom-root contract and its provenance field do not exist in the candidate snapshot."}
  ]
}
