{
  "$schema": "../../../schema/authority-map.schema.json",
  "schema_version": "1.0",
  "case_id": "H07",
  "status": "draft",
  "normalization": {"level": "N0", "task_blind": true, "semantic_additions": false, "normalizer_ref": "audit/provenance.md#normalizer"},
  "provenance_ref": "audit/provenance.md",
  "authorities": [
    {"authority_id": "repo.architecture", "logical_role": "architecture", "exposed_path": "SPEC.md", "availability": "present_at_cutoff", "source": {"kind": "repo_file", "cutoff_ref": "d96b7c4ea5196186588443b3ae88f61955bd41e5", "path": "SPEC.md", "sha256": "80b3e30e8fde08ce2b8a80becf70a791c15cd90fe3402a2f795d557adeb6caa3"}, "transform": "copy", "semantic_delta": false},
    {"authority_id": "docs.knowledge-router", "logical_role": "development", "exposed_path": "docs/README.md", "availability": "present_at_cutoff", "source": {"kind": "repo_file", "cutoff_ref": "d96b7c4ea5196186588443b3ae88f61955bd41e5", "path": "docs/README.md", "sha256": "14c40009bd598287831b845160de60781ec743dcef8ced2ad3185b968c32b881"}, "transform": "copy", "semantic_delta": false},
    {"authority_id": "kernel.sdk-contract", "logical_role": "product_contract", "exposed_path": "docs/specs/kernel/sdk-boundary.md", "availability": "present_at_cutoff", "source": {"kind": "repo_file", "cutoff_ref": "d96b7c4ea5196186588443b3ae88f61955bd41e5", "path": "docs/specs/kernel/sdk-boundary.md", "sha256": "9d88c641801160092f3cd1d050f9172fc51c50657469c7eca3c40485430f26b2"}, "transform": "copy", "semantic_delta": false},
    {"authority_id": "kernel.tools-hooks-contract", "logical_role": "product_contract", "exposed_path": "docs/specs/kernel/tools-hooks.md", "availability": "present_at_cutoff", "source": {"kind": "repo_file", "cutoff_ref": "d96b7c4ea5196186588443b3ae88f61955bd41e5", "path": "docs/specs/kernel/tools-hooks.md", "sha256": "1e225aa426eb4abbfb748e22d4c3f32d1406566c573a36cef6731e0cfeca8b48"}, "transform": "copy", "semantic_delta": false},
    {"authority_id": "gateway.heartbeat-contract", "logical_role": "product_contract", "exposed_path": "docs/specs/gateway/heartbeat-cron.md", "availability": "present_at_cutoff", "source": {"kind": "repo_file", "cutoff_ref": "d96b7c4ea5196186588443b3ae88f61955bd41e5", "path": "docs/specs/gateway/heartbeat-cron.md", "sha256": "0fedf3ee454c0f0bed4b82e881df6d6c68312d33a454bc99dcb8e458340c0d40"}, "transform": "copy", "semantic_delta": false},
    {"authority_id": "cli.product-contract", "logical_role": "product_contract", "exposed_path": "docs/specs/cli/product-integration.md", "availability": "present_at_cutoff", "source": {"kind": "repo_file", "cutoff_ref": "d96b7c4ea5196186588443b3ae88f61955bd41e5", "path": "docs/specs/cli/product-integration.md", "sha256": "f196ab3d1fe3f8d5201ff53c0af1d3da2eaddcc06790d33a16621982a9a07fff"}, "transform": "copy", "semantic_delta": false},
    {"authority_id": "kernel.public-api", "logical_role": "architecture", "exposed_path": "src/agent/sdk/kernel.py", "availability": "present_at_cutoff", "source": {"kind": "repo_file", "cutoff_ref": "d96b7c4ea5196186588443b3ae88f61955bd41e5", "path": "src/agent/sdk/kernel.py", "sha256": "505f63109e48a6c289aa83145e8d92002e1b344bb2f53c419f6f42e36c623716"}, "transform": "copy", "semantic_delta": false},
    {"authority_id": "pa.product-composition", "logical_role": "architecture", "exposed_path": "src/personal_assistant/product.py", "availability": "present_at_cutoff", "source": {"kind": "repo_file", "cutoff_ref": "d96b7c4ea5196186588443b3ae88f61955bd41e5", "path": "src/personal_assistant/product.py", "sha256": "9f5e5f52151179ccd2b3a5576bf2b93c302bfd880b0e18f9b16ef84a58e90764"}, "transform": "copy", "semantic_delta": false},
    {"authority_id": "cli.product-composition", "logical_role": "architecture", "exposed_path": "src/coding_cli/product.py", "availability": "present_at_cutoff", "source": {"kind": "repo_file", "cutoff_ref": "d96b7c4ea5196186588443b3ae88f61955bd41e5", "path": "src/coding_cli/product.py", "sha256": "6a64f7beb5f05ca347bcab0c579b35f8a48a7872ccf90424ccd4eaba2c179ab9"}, "transform": "copy", "semantic_delta": false},
    {"authority_id": "im.workspace-model", "logical_role": "architecture", "exposed_path": "src/IM/domain/models.py", "availability": "present_at_cutoff", "source": {"kind": "repo_file", "cutoff_ref": "d96b7c4ea5196186588443b3ae88f61955bd41e5", "path": "src/IM/domain/models.py", "sha256": "d8321a496d4c8320c77560ac231c1758f03057e039918aad746fe21e9d8b3d52"}, "transform": "copy", "semantic_delta": false},
    {"authority_id": "history.target-unit", "logical_role": "historical_decision", "exposed_path": "__absent__/refactor-513-pa-workspace-layout", "availability": "absent_at_cutoff", "source": {"kind": "none", "cutoff_ref": "d96b7c4ea5196186588443b3ae88f61955bd41e5"}, "transform": "absent_marker", "semantic_delta": false, "notes": "The product-specific layout, per-turn scope and migration plan do not exist in the candidate snapshot."}
  ]
}
